[
  {"id": "scratch", "name": "Scratch", "type": "Fire", "power": 40, "accuracy": 100, "basePP": 35, "category": "Physical"},
  {"id": "tackle", "name": "Tackle", "type": "Fire", "power": 40, "accuracy": 100, "basePP": 35, "category": "Physical"},
  {"id": "flame-burst", "name": "Flame Burst", "type": "Fire", "power": 70, "accuracy": 100, "basePP": 15, "category": "Special", "effect": {"type": "burn", "chance": 10}},
  {"id": "ember", "name": "Ember", "type": "Fire", "power": 40, "accuracy": 100, "basePP": 25, "category": "Special", "effect": {"type": "burn", "chance": 10}},
  {"id": "inferno", "name": "Inferno", "type": "Fire", "power": 100, "accuracy": 50, "basePP": 5, "category": "Special", "effect": {"type": "burn", "chance": 100}},
  {"id": "aqua-ring", "name": "Aqua Ring", "type": "Water", "power": 0, "accuracy": 100, "basePP": 20, "category": "Status", "effect": {"type": "heal", "value": 12.5}},
  {"id": "water-gun", "name": "Water Gun", "type": "Water", "power": 40, "accuracy": 100, "basePP": 25, "category": "Special"},
  {"id": "bubblebeam", "name": "Bubble Beam", "type": "Water", "power": 65, "accuracy": 100, "basePP": 20, "category": "Special"},
  {"id": "hydro-pump", "name": "Hydro Pump", "type": "Water", "power": 110, "accuracy": 80, "basePP": 5, "category": "Special"},
  {"id": "vine-whip", "name": "Vine Whip", "type": "Grass", "power": 45, "accuracy": 100, "basePP": 25, "category": "Physical"},
  {"id": "growth", "name": "Growth", "type": "Grass", "power": 0, "accuracy": 100, "basePP": 40, "category": "Status", "effect": {"type": "stat-boost", "value": 1}},
  {"id": "synthesis", "name": "Synthesis", "type": "Grass", "power": 0, "accuracy": 100, "basePP": 5, "category": "Status", "effect": {"type": "heal", "value": 25}},
  {"id": "solar-beam", "name": "Solar Beam", "type": "Grass", "power": 120, "accuracy": 100, "basePP": 10, "category": "Special"},
  {"id": "thunderbolt", "name": "Thunderbolt", "type": "Electric", "power": 90, "accuracy": 100, "basePP": 15, "category": "Special", "effect": {"type": "paralyze", "chance": 10}},
  {"id": "spark", "name": "Spark", "type": "Electric", "power": 65, "accuracy": 100, "basePP": 20, "category": "Physical", "effect": {"type": "paralyze", "chance": 30}},
  {"id": "thunder", "name": "Thunder", "type": "Electric", "power": 110, "accuracy": 70, "basePP": 10, "category": "Special", "effect": {"type": "paralyze", "chance": 30}},
  {"id": "thunder-wave", "name": "Thunder Wave", "type": "Electric", "power": 0, "accuracy": 100, "basePP": 20, "category": "Status", "effect": {"type": "paralyze", "chance": 100}},
  {"id": "psychic", "name": "Psychic", "type": "Psychic", "power": 90, "accuracy": 100, "basePP": 10, "category": "Special", "effect": {"type": "lower-spdef", "chance": 10}},
  {"id": "confusion", "name": "Confusion", "type": "Psychic", "power": 50, "accuracy": 100, "basePP": 25, "category": "Special", "effect": {"type": "confusion", "chance": 10}},
  {"id": "teleport", "name": "Teleport", "type": "Psychic", "power": 0, "accuracy": 100, "basePP": 20, "category": "Status"},
  {"id": "earthquake", "name": "Earthquake", "type": "Ground", "power": 100, "accuracy": 100, "basePP": 10, "category": "Physical"},
  {"id": "magnitude", "name": "Magnitude", "type": "Ground", "power": 100, "accuracy": 100, "basePP": 30, "category": "Physical"},
  {"id": "mud-slap", "name": "Mud Slap", "type": "Ground", "power": 20, "accuracy": 100, "basePP": 10, "category": "Physical"},
  {"id": "bite", "name": "Bite", "type": "Dark", "power": 60, "accuracy": 100, "basePP": 25, "category": "Physical"},
  {"id": "crunch", "name": "Crunch", "type": "Dark", "power": 80, "accuracy": 100, "basePP": 15, "category": "Physical"},
  {"id": "dark-pulse", "name": "Dark Pulse", "type": "Dark", "power": 80, "accuracy": 100, "basePP": 15, "category": "Special"},
  {"id": "fairy-wind", "name": "Fairy Wind", "type": "Fairy", "power": 40, "accuracy": 100, "basePP": 30, "category": "Special"},
  {"id": "moonblast", "name": "Moonblast", "type": "Fairy", "power": 95, "accuracy": 100, "basePP": 15, "category": "Special"},
  {"id": "dazzling-gleam", "name": "Dazzling Gleam", "type": "Fairy", "power": 70, "accuracy": 100, "basePP": 15, "category": "Special"},
  {"id": "dragon-claw", "name": "Dragon Claw", "type": "Fire", "power": 80, "accuracy": 100, "basePP": 15, "category": "Physical"},
  {"id": "iron-head", "name": "Iron Head", "type": "Fire", "power": 80, "accuracy": 100, "basePP": 15, "category": "Physical"},
  {"id": "stone-edge", "name": "Stone Edge", "type": "Fire", "power": 100, "accuracy": 80, "basePP": 5, "category": "Physical"},
  {"id": "reflect", "name": "Reflect", "type": "Psychic", "power": 0, "accuracy": 100, "basePP": 20, "category": "Status"},
  {"id": "light-screen", "name": "Light Screen", "type": "Psychic", "power": 0, "accuracy": 100, "basePP": 30, "category": "Status"}
]
